title,url,domain,score
Law and policy,https://www.ilo.org/coop-sse-law-policy,ilo.org,0.221
Estonia ratifies the 1986 Instrument of Amendment to the ILO Constitution,https://www.ilo.org/resource/news/estonia-ratifies-1986-instrument-amendment-ilo-constitution,ilo.org,0.241
Common Challenges Organizations Face With AI Adoption—and How to Overcome Them,https://www.mbopartners.com/blog/independent-workforce-trends/common-challenges-organizations-face-when-implementing-ai-and-how-to-overcome-them/,mbopartners.com,0.268
How Are Independent Professionals Using AI to Get Ahead?,https://www.mbopartners.com/blog/how-grow-small-business/5-ways-to-use-generative-ai-for-your-small-business/,mbopartners.com,0.252
Why Independent Professionals Are Leading the Way in AI Adoption,https://www.mbopartners.com/blog/independent-workforce-trends/why-independent-contractors-are-leading-ai-adoption/,mbopartners.com,0.267
Dear SaaStr: How Do I Structure a Comp Package for Our First VP of Sales?,https://www.saastr.com/dear-saastr-how-do-i-structure-a-comp-package-for-our-first-vp-of-sales/,saastr.com,0.226
Dear SaaStr: What Are Signs It’s Finally Time to Move on From An Employee?,https://www.saastr.com/dear-saastr-what-are-signs-its-finally-time-to-move-on-from-an-employee/,saastr.com,0.244
