title,url,domain,score
Estonia ratifies the 1986 Instrument of Amendment to the ILO Constitution,https://www.ilo.org/resource/news/estonia-ratifies-1986-instrument-amendment-ilo-constitution,ilo.org,0.231
Littler Strengthens Labor Practice with the Addition of Veteran Labor Relations Attorney Dan Mueller,https://www.littler.com/press/press-release/littler-strengthens-labor-practice-addition-veteran-labor-relations-attorney,littler.com,0.240
Littler Featured in 2026 Chambers Latin America Guide,https://www.littler.com/press/press-release/littler-featured-2026-chambers-latin-america-guide,littler.com,0.263
Common Challenges Organizations Face With AI Adoption—and How to Overcome Them,https://www.mbopartners.com/blog/independent-workforce-trends/common-challenges-organizations-face-when-implementing-ai-and-how-to-overcome-them/,mbopartners.com,0.238
How Are Independent Professionals Using AI to Get Ahead?,https://www.mbopartners.com/blog/how-grow-small-business/5-ways-to-use-generative-ai-for-your-small-business/,mbopartners.com,0.222
Why Independent Professionals Are Leading the Way in AI Adoption,https://www.mbopartners.com/blog/independent-workforce-trends/why-independent-contractors-are-leading-ai-adoption/,mbopartners.com,0.237
Dear SaaStr: What Are Signs It’s Finally Time to Move on From An Employee?,https://www.saastr.com/dear-saastr-what-are-signs-its-finally-time-to-move-on-from-an-employee/,saastr.com,0.234
